{
  "schemaVersion": "1.0",
  "tool": "easy-ads-validator",
  "version": "1.1.0",
  "profile": "max-unity",
  "project": {
    "rootPath": "sample-unity-project",
    "displayName": "valid-max-basic",
    "isUnityProject": true
  },
  "scan": {
    "startedAt": "2026-07-19T12:17:22.433653+00:00",
    "toolVersion": "1.1.0",
    "profileId": "max-unity",
    "includePasses": false,
    "failOn": "fail",
    "verbose": false,
    "reportDetail": "compact",
    "maxEvidencePerFinding": 3,
    "summaryOnly": false
  },
  "summary": {
    "passCount": 31,
    "failCount": 0,
    "warnCount": 7,
    "unknownCount": 9,
    "internalWarnCount": 0,
    "isPartial": false,
    "meetsFailureThreshold": false,
    "score": {
      "value": 93,
      "grade": "A",
      "categories": [
        {
          "category": "sdkimport",
          "passCount": 4,
          "nonPassCount": 1,
          "totalCount": 5,
          "completionPercent": 80
        },
        {
          "category": "platformsettings",
          "passCount": 4,
          "nonPassCount": 2,
          "totalCount": 6,
          "completionPercent": 66
        },
        {
          "category": "initialization",
          "passCount": 7,
          "nonPassCount": 1,
          "totalCount": 8,
          "completionPercent": 87
        },
        {
          "category": "consent",
          "passCount": 5,
          "nonPassCount": 1,
          "totalCount": 6,
          "completionPercent": 83
        },
        {
          "category": "dependencies",
          "passCount": 5,
          "nonPassCount": 0,
          "totalCount": 5,
          "completionPercent": 100
        },
        {
          "category": "callbacks",
          "passCount": 3,
          "nonPassCount": 2,
          "totalCount": 5,
          "completionPercent": 60
        },
        {
          "category": "loading",
          "passCount": 1,
          "nonPassCount": 4,
          "totalCount": 5,
          "completionPercent": 20
        },
        {
          "category": "revenue",
          "passCount": 1,
          "nonPassCount": 3,
          "totalCount": 4,
          "completionPercent": 25
        },
        {
          "category": "productionsafety",
          "passCount": 1,
          "nonPassCount": 2,
          "totalCount": 3,
          "completionPercent": 33
        }
      ]
    },
    "triage": {
      "criticalIssueCount": 0,
      "highIssueCount": 2,
      "manualReviewCount": 0,
      "unknownCount": 9
    }
  },
  "findings": [
    {
      "id": "MAX081",
      "title": "Revenue callback forwards to configured analytics sinks",
      "category": "revenue",
      "status": "WARN",
      "severity": "high",
      "confidence": "medium",
      "message": "Revenue callback exists but no configured analytics sink evidence was found.",
      "evidence": [
        {
          "filePath": "Assets/Scripts/AdsManager.cs",
          "line": 20,
          "column": 9,
          "snippet": null,
          "symbol": "MaxSdkCallbacks.Interstitial.OnAdRevenuePaidEvent"
        },
        {
          "filePath": "Assets/Scripts/AdsManager.cs",
          "line": 27,
          "column": 9,
          "snippet": null,
          "symbol": "MaxSdkCallbacks.Rewarded.OnAdRevenuePaidEvent"
        }
      ],
      "remediation": "Forward MAX impression revenue to a configured analytics sink or update analyticsRevenueSinks policy.",
      "docsUrl": null,
      "ruleVersion": "1.0.0",
      "evidenceSummary": {
        "totalCount": 2,
        "shownCount": 2,
        "omittedCount": 0
      }
    },
    {
      "id": "MAX032",
      "title": "MAX initialization is guarded",
      "category": "initialization",
      "status": "WARN",
      "severity": "medium",
      "confidence": "medium",
      "message": "InitializeSdk does not appear guarded by local initialization state.",
      "evidence": [
        {
          "filePath": "Assets/Scripts/AdsManager.cs",
          "line": 10,
          "column": 9,
          "snippet": null,
          "symbol": "MaxSdk.InitializeSdk()"
        }
      ],
      "remediation": "Guard MAX initialization so repeated lifecycle entry points cannot initialize the SDK more than once.",
      "docsUrl": null,
      "ruleVersion": "1.0.0",
      "evidenceSummary": {
        "totalCount": 1,
        "shownCount": 1,
        "omittedCount": 0
      }
    },
    {
      "id": "MAX071",
      "title": "Retry system exists for failed loads",
      "category": "loading",
      "status": "WARN",
      "severity": "medium",
      "confidence": "medium",
      "message": "Load-failure callbacks exist but retry scheduling evidence was not found.",
      "evidence": [
        {
          "filePath": "Assets/Scripts/AdsManager.cs",
          "line": 16,
          "column": 9,
          "snippet": null,
          "symbol": "MaxSdkCallbacks.Interstitial.OnAdLoadFailedEvent"
        },
        {
          "filePath": "Assets/Scripts/AdsManager.cs",
          "line": 22,
          "column": 9,
          "snippet": null,
          "symbol": "MaxSdkCallbacks.Rewarded.OnAdLoadFailedEvent"
        }
      ],
      "remediation": "Schedule bounded retries from failed load/display callbacks.",
      "docsUrl": null,
      "ruleVersion": "1.0.0",
      "evidenceSummary": {
        "totalCount": 2,
        "shownCount": 2,
        "omittedCount": 0
      }
    },
    {
      "id": "MAX073",
      "title": "Video ads reload after close or fail callbacks",
      "category": "loading",
      "status": "WARN",
      "severity": "medium",
      "confidence": "medium",
      "message": "Video ad use exists but reload-after-close/fail evidence was not found.",
      "evidence": [
        {
          "filePath": "Assets/Scripts/AdsManager.cs",
          "line": 28,
          "column": 9,
          "snippet": null,
          "symbol": "MaxSdk.LoadInterstitial()",
          "role": "context"
        },
        {
          "filePath": "Assets/Scripts/AdsManager.cs",
          "line": 29,
          "column": 9,
          "snippet": null,
          "symbol": "MaxSdk.LoadRewardedAd()",
          "role": "context"
        },
        {
          "filePath": "Assets/Scripts/AdsManager.cs",
          "line": 36,
          "column": 13,
          "snippet": null,
          "symbol": "MaxSdk.ShowInterstitial()",
          "role": "context"
        }
      ],
      "remediation": "Reload interstitial and rewarded ads from hidden/closed and load/display failure callbacks.",
      "docsUrl": null,
      "ruleVersion": "1.0.0",
      "evidenceSummary": {
        "totalCount": 3,
        "shownCount": 3,
        "omittedCount": 0
      },
      "unresolved": [
        "No direct, scheduled, or terminal-named reload chain was proven from static C# evidence."
      ]
    },
    {
      "id": "MAX023",
      "title": "Placement names are tracked",
      "category": "revenue",
      "status": "WARN",
      "severity": "low",
      "confidence": "medium",
      "message": "MAX show or placement calls do not consistently include meaningful placement names.",
      "evidence": [
        {
          "filePath": "Assets/Scripts/AdsManager.cs",
          "line": 36,
          "column": 13,
          "snippet": null,
          "symbol": "MaxSdk.ShowInterstitial()"
        }
      ],
      "remediation": "Pass placement/source names to MAX show calls, banner/MREC placement setters, or a connected show abstraction.",
      "docsUrl": null,
      "ruleVersion": "1.0.0",
      "evidenceSummary": {
        "totalCount": 1,
        "shownCount": 1,
        "omittedCount": 0
      }
    },
    {
      "id": "MAX074",
      "title": "Ad type loading is staged after initialization",
      "category": "loading",
      "status": "WARN",
      "severity": "low",
      "confidence": "medium",
      "message": "Ad load calls do not show obvious staging or delay.",
      "evidence": [
        {
          "filePath": "Assets/Scripts/AdsManager.cs",
          "line": 28,
          "column": 9,
          "snippet": null,
          "symbol": "MaxSdk.LoadInterstitial()"
        },
        {
          "filePath": "Assets/Scripts/AdsManager.cs",
          "line": 29,
          "column": 9,
          "snippet": null,
          "symbol": "MaxSdk.LoadRewardedAd()"
        }
      ],
      "remediation": "Consider staging initial ad loads to reduce startup contention.",
      "docsUrl": null,
      "ruleVersion": "1.0.0",
      "evidenceSummary": {
        "totalCount": 2,
        "shownCount": 2,
        "omittedCount": 0
      }
    },
    {
      "id": "MAX082",
      "title": "Revenue payload includes important fields",
      "category": "revenue",
      "status": "WARN",
      "severity": "low",
      "confidence": "medium",
      "message": "Revenue payload evidence may be missing fields: network, precision.",
      "evidence": [
        {
          "filePath": "Assets/Scripts/AdsManager.cs",
          "line": 20,
          "column": 9,
          "snippet": null,
          "symbol": "MaxSdkCallbacks.Interstitial.OnAdRevenuePaidEvent"
        },
        {
          "filePath": "Assets/Scripts/AdsManager.cs",
          "line": 27,
          "column": 9,
          "snippet": null,
          "symbol": "MaxSdkCallbacks.Rewarded.OnAdRevenuePaidEvent"
        },
        {
          "filePath": "Assets/Scripts/AdsManager.cs",
          "line": 20,
          "column": 9,
          "snippet": null,
          "symbol": "MaxSdkCallbacks.Interstitial.OnAdRevenuePaidEvent"
        }
      ],
      "remediation": "Include revenue, network, ad unit, placement, and precision where available in analytics payloads.",
      "docsUrl": null,
      "ruleVersion": "1.0.0",
      "evidenceSummary": {
        "totalCount": 4,
        "shownCount": 3,
        "omittedCount": 1
      }
    },
    {
      "id": "MAX006",
      "title": "MAX SDK assembly definitions exist",
      "category": "sdkimport",
      "status": "UNKNOWN",
      "severity": "high",